{
  "$schema": "https://json-schema.org/draft/2020-12/schema",
  "title": "Normalized Finding",
  "type": "object",
  "required": [
    "finding_id",
    "source_audit_id",
    "project",
    "auditor",
    "date",
    "severity_original",
    "severity_normalized",
    "status",
    "contracts",
    "functions",
    "root_cause",
    "exploit_path",
    "trigger_condition",
    "vulnerable_snippet",
    "recommendation",
    "false_positive_lookalikes",
    "tags",
    "source_pages",
    "confidence",
    "evidence_strength",
    "reproducibility",
    "notes"
  ],
  "properties": {
    "finding_id": { "type": "string", "minLength": 1 },
    "source_audit_id": { "type": "string", "minLength": 1 },
    "project": { "type": "string", "minLength": 1 },
    "auditor": { "type": "string", "minLength": 1 },
    "date": { "type": "string", "format": "date" },
    "severity_original": { "type": "string", "minLength": 1 },
    "severity_normalized": {
      "type": "string",
      "enum": ["critical", "high", "medium", "low", "info", "best_practice"]
    },
    "status": { "type": "string", "minLength": 1 },
    "contracts": { "type": "array", "items": { "type": "string", "minLength": 1 }, "minItems": 1 },
    "functions": { "type": "array", "items": { "type": "string", "minLength": 1 }, "minItems": 1 },
    "root_cause": { "type": "string", "minLength": 1 },
    "exploit_path": { "type": "string", "minLength": 1 },
    "trigger_condition": { "type": "string", "minLength": 1 },
    "vulnerable_snippet": { "type": "string", "minLength": 1 },
    "fixed_snippet": { "type": ["string", "null"] },
    "recommendation": { "type": "string", "minLength": 1 },
    "test_that_catches_it": { "type": ["string", "null"] },
    "false_positive_lookalikes": { "type": "array", "items": { "type": "string", "minLength": 1 }, "minItems": 1 },
    "tags": { "type": "array", "items": { "type": "string" }, "minItems": 1 },
    "source_pages": { "type": "array", "items": { "type": "integer", "minimum": 1 }, "minItems": 1 },
    "confidence": { "type": "string", "enum": ["low", "medium", "high"] },
    "evidence_strength": { "type": "string", "enum": ["weak", "moderate", "strong"] },
    "reproducibility": { "type": "string", "enum": ["not_reproduced", "reasoned", "confirmed_by_report", "confirmed_by_fix"] },
    "notes": { "type": "string", "minLength": 1 }
  },
  "additionalProperties": false
}
